 Tweet Text, Informativeness
Police helicopter crashes into pub Glasgow (liveleak): @YouTube aracılığıyla http://t.co/fgj974hpK4,Related and informative
Scottish Police Say A Number Of Casualties In Helicopter Crash Some Trapped http://t.co/l90h3DoaMD #NEWS,Related and informative
Glasgow helicopter crash: Number of dead expected to rise say police http://t.co/knKj6T1tx6 【英語学習書】　http://t.co/Qi25rszXJV,Related and informative
RIP to all that have passed in the helicopter crash in Glasgow. Hope that everyone still there can be taken out as soon as possible. 💕💗😇,Related - but not informative
Helicopter crash in Glasgow!!!?! Thoughts to all those involved.,Related - but not informative
Oh Glasgow. :( my heart goes out to the city what a horrible thing to happen. #Clutha,Related - but not informative
Glasgow pub helicopter crash - live updates http://t.co/TVSvvIuAG6,Related and informative
can't believe i was in glasgow when the helicopter crashed man,Related - but not informative
#GlasgowHelicopter crash is 3rd major helicopter accident this year after similar crashes on North Sea &amp; in London @De_Persdienst #Glasgow,Related - but not informative
BBC News - Glasgow helicopter crash: Response 'courage' praised http://t.co/b5JKnNq3De,Related and informative
Great angle from the BBC questioning the safety of the #Clutha A fecking helicopter crash landed into it!!,Related - but not informative
Glasgow helicopter crash: 'Three dead' at Clutha pub - BBC News http://t.co/3WsyCnZWgl,Related and informative
Emergency services in Glasgow deserve medals. Helicopter crash large city centre fire and someone struck by a train in one night.,Related and informative
Please spare a thought for those involved in the Glasgow helicopter crash which happened yesterday at 2225pm &lt;/3 @MrPeterAndre,Related - but not informative
Police helicopter crashes ‘like a stone’ into Glasgow pub - http://t.co/oOdjPe5W03,Related and informative
Thinking of everyone affected by the helicopter crash in Glasgow - only 10 minutes away from where it happened.,Related - but not informative
@HuffPostUK: This is a black day for Glasgow and Scotland but it is also St Andrew's Day. #Clutha Glasgow http://t.co/HN7tObU9k8,Related - but not informative
Glasgow pub helicopter crash: investigators examine wreckage http://t.co/xNuCAit4I7,Related and informative
Canada-CBC News:  Police helicopter fell like a stone through roof of Glasgow pub . More #Aviation #news - http://t.co/oi3JLGKopD,Related and informative
Police Scotland confirm 8 people have died 14 seriously injured by the Glasgow helicopter crash according to @STVNews,Related and informative
Eight dead in pub helicopter crash http://t.co/QFK0Nb0AZU,Related and informative
Helicopter crash in Glasgow leaves 8 dead on Friday. http://t.co/9L34qKGaQI,Related and informative
Now 8 confirmed dead in the helicopter crash?! Fuck 😐,Related and informative
Reports of selfless calm efficiency by public on scene at #Clutha was very powerful. In a crisis Who You Gonna Call? Scottish!,Related - but not informative
So sad to hear of eight fatalities after the #clutha incident last night.,Related - but not informative
Death toll for the helicopter crash keeps rising. Thoughts go out to those affected horrendous scenes.,Related and informative
If you're out tonight raise a glass to those 8 people who never made it home last night &amp; all those affected. #Clutha,Related - but not informative
Condolences to the families of all those who died in the #clutha accident. No one should go to work or a night out and not come home.,Related - but not informative
18:08  AFP BREAKING: Eight killed in Glasgow pub helicopter crash say Scottish police,Related and informative
#Breaking: The Queen says her thoughts and prayers are with victims of the pub helicopter crash in Glasgow - @BBCNews http://t.co/Cx7B2SXHA3,Related and informative
8 Dead In Police Helicopter Crash Onto Glasgow Pub http://t.co/z9HWwrIbgZ,Related and informative
The Queen has said her thoughts and prayers are with the victims. #clutha #helicoptercrash http://t.co/LhKjyLPQxm,Related - but not informative
How far are you from the helicopter crash.,Related - but not informative
Video: Eyewitness describes 'tragic' helicopter crash in Glasgow http://t.co/QdDaV7kVXV,Related and informative
Glasgow dealt with a disaster and gave all to save their own and that's courage We owe gratitude to our Services! @scotfire_west #Clutha,Related - but not informative
Police helicopter crashes into packed Glasgow pub killing at least 8: By Marian Smith and Elisha Fieldstadt ... http://t.co/6unpmRG7tc,Related and informative
Wow. Fireman working at the Glasgow helicopter crash til 8am is captaining Stranraer in the Scottish Cup this afternoon. Made of other stuff,Related and informative
Police helicopter crashes into crowded Glasgow pub eight confirmed dead - National Post http://t.co/RWl8KWOgzd,Related and informative
New post: 8 dead in police helicopter crash onto Glasgow pub http://t.co/n2cyVolKnV,Related and informative
Photos: Major rescue effort: A helicopter crashes into a pub in the Scottish city of Glasgow       http://t.co/RGCZCQ647e,Related and informative
Photos: Major rescue effort: A helicopter crashes into a pub in the Scottish city of Glasgow       http://t.co/P6WvDAM0C5,Related and informative
.@onedirslaytion Helicopter Crashes Into Glasgow Pub: Eight Die: Three of the dead were the crew of the aircraft and f...  @orgasmicgomez,Related and informative
@orgasmicgomez Helicopter Crashes Into Glasgow Pub: Eight Die: Three of the dead were the crew of the aircraft and fi...  @onedirslaytion,Related and informative
@orgasmicgomez Helicopter Crashes Into Glasgow Pub: Eight Die  @onedirslaytion,Related and informative
The STV news bulletin at 1805 will bring together all the elements of the tragic #Clutha story live from the scene.,Related and informative
1 dead in police helicopter crash onto Glasgow pub,Related and informative
Incredible that Stranraer captain was on duty as fireman until 8am at #clutha and is now lining up v Clyde.,Related and informative
eight fatalities...so far... :( BBC News - Glasgow helicopter crash: Eight dead at Clutha pub http://t.co/H4UnD1xo3o,Related and informative
Thoughts and prayers are with the people involved in the Glasgow helicopter crash at Clutha in way. Sending love to those who helped 🙏,Related - but not informative
Police Helicopter Crashes Into Crowded Glasgow Pub - New York Times: New York TimesPolice Helicopter Crashes I... http://t.co/q9kOzjBTIq,Related and informative
Police Helicopter Crashes Into Crowded Glasgow Pub - New York Times: New York TimesPolice Helicopter Crashes I... http://t.co/HB23BqYkRw,Related and informative
Eight dead in pub helicopter crash http://t.co/2oa9Lpv4Bf,Related and informative
Live blog now closed. Here's the latest Guardian piece on #Clutha disaster http://t.co/Ds6t1qyVyd,Related and informative
.@onedirslaytion Death toll from pub helicopter crash rises: Five people were killed inside the pub and three in the h...  @orgasmicgomez,Related and informative
|Eight die in Glasgow pub helicopter crash (The Sydney Morning Herald ): Share With Friends:  ||  || Top News Sto... http://t.co/4PC18vw8Id|,Related and informative
Thoughts are with all the people involved in the helicopter crash in Glasgow last night xxx,Related - but not informative
Rip to the 8 people who died today in Glasgow  3 in the helicopter and the other 5 in the building. So sad 😔,Related and informative
BBC News - Glasgow helicopter crash: Eight dead at Clutha pub http://t.co/gifeN7WAqT,Related and informative
the police helicopter crash in Glasgow is awful. :( thinking of everyone involved.,Related - but not informative
My thoughts &amp; prayers are with everyone involved in the Helicopter crash in Glasgow last night so so sad &amp; unbelievable xxxx,Related - but not informative
@orgasmicgomez Helicopter Crash: Scotland Mourns Victims: Football matches fall silent and St Andrew's Day events are...  @onedirslaytion,Related and informative
I really don't understand why people think it is acceptable to make jokes about the helicopter crash in Glasgow.  8 people have died.,Related - but not informative
1 dead in police helicopter crash onto Glasgow pub: Scottish emergency workers were sifting through w... http://t.co/xVJgQoCTwz #memphis,Related and informative
@garybarlow Sad day. Prayers for #Clutha victims,Related - but not informative
still canny believe the helicopter crash at Glasgow!,Related - but not informative
Heart and Thoughts with #Glasgow &lt;3 - Eight dead at #Clutha pub http://t.co/yiWwYjeP1Z,Related - but not informative
“@glasgow_taxis: Anyone with loved ones in hospital from #Clutha &amp; struggling for transport to visit we'll provide free taxis 01414297070”,Related and informative
.@orgasmicgomez Eight dead in pub helicopter crash: Eight people have died and 14 people are in hospital after a poli...  @onedirslaytion,Related and informative
@mcguire77 @KTHopkins knowing her propensity for trying to shock I’m sure she’s loving the attention! #disgrace #Clutha,Not related
@onedirslaytion Helicopter Crash: Relatives Face Anxious Wait: A very sensitive and complex rescue operation is taki...  @orgasmicgomez,Related and informative
8 Killed in Scotland Helicopter Crash http://t.co/71GaPt5plY,Related and informative
My thoughts are with those in Glasgow following the Helicopter crash last night. Shocking. :(,Related - but not informative
Rest in Peace to all those who have lost their lives in #Clutha Makes me proud to see Glasgow working together to help friends and family,Related - but not informative
Scottish holiday marred by police helicopter crash http://t.co/7qkrZCN1JP via @socialreader,Related and informative
PLEASE SEND YOUR LOVE AND PRAYERS TO THE FAMILY'S OF THE HORRIFIC HELICOPTER CRASH IN GLASGOW!!!!!!!!!!!,Related - but not informative
Glasgow helicopter crash: At least eight dead including two police officers and five revellers http://t.co/yYFxC3appg,Related and informative
@glasgow_taxis: Anyone with loved ones in hospital from #Clutha &amp; struggling for transport to visit we'll provide free taxis 01414297070,Related and informative
Glasgow helicopter crash: search for survivors continues http://t.co/Bov3qgpYr3,Related and informative
Police reveal name of one victim of last night's helicopter crash in Glasgow. Gary Arthur(48) died after helicopter came through a pub roof,Related and informative
Correction: Family members confirm David Traill was among the eight people killed in the helicopter crash in Glasgow http://t.co/ptAY4QPIZu,Related and informative
Police name Glasgow helicopter victim: Police have named one of the eight people who died after a helicopter c... http://t.co/vN86WooBkI,Related and informative
Doing it right: MT @glasgow_taxis: Anyone w/ loved ones in hospital from #Clutha struggling for transport to visit we'll provide free taxis,Related and informative
.@onedirslaytion Glasgow Helicopter Crash: Police Name A Victim: Police say a complex and dangerous rescue and recov...  @orgasmicgomez,Related and informative
Scenes of devastation after crash: One story dominates the Sunday front pages - the helicopter crash in Glasgo... http://t.co/xiiFxDhd9r,Related and informative
has anyone heard of the helicopter that smashed down into a glasgow pub,Related - but not informative
Helicopter crashes into Glasgow pub many fatalities feared - Times of India: Times of IndiaHelicopter crashes... http://t.co/HodN1tHePH,Related and informative
@orgasmicgomez Glasgow helicopter victim named  @onedirslaytion,Related and informative
A helicopter crash in Glasgow. Hope everyone is alright.,Related - but not informative
Officials confirm 8 people killed in Glasgow helicopter crash - CTV News http://t.co/igmYeSaNL4,Related and informative
Police helicopter crashes into packed Glasgow pub killing at least 8 - World News http://t.co/DgyGAr3PTc via @NBCnews,Related and informative
@orgasmicgomez Search on for helicopter crash victims: The search for victims after a police helicopter rammed into a...  @onedirslaytion,Related and informative
@orgasmicgomez Search on for helicopter crash victims: The search for victims after a police helicopter rammed into a...  @onedirslaytion,Related and informative
@orgasmicgomez Search on for helicopter crash victims  @onedirslaytion,Not applicable
check this out Glasgow helicopter crash: Response 'courage' praised - BBC News: BBC NewsGlasgow helicopt... http://t.co/hJnCuY8HNv #news,Related and informative
https://t.co/0b1fwsuDZw sharing this and thinking of everyone at #clutha,Related - but not informative
Weekend of horrible tragic news! Heartbreaking 💔 #Clutha #RIPPaulWalker x,Related - but not informative
My heart goes out to the family and friends of the victims of the Glasgow helicopter crash. You have helped us through our tragedies YNWA,Related - but not informative
One of the helicopter's rotor blades being removed from crash scene for examination #Clutha #Glasgow http://t.co/VtvrYNBUYE,Related and informative
Glasgow helicopter crash: Flags to fly at half-mast across Scotland after tragedy http://t.co/BCf52lNmcu #uknews #news,Related and informative
Whilst I appreciate it is sad about Paul Walker what about the officers and customers killed in the helicopter crash in Glasgow,Related - but not informative
Photo: Kirsty Nelis reported locally as police officer killed in #Glasgow helicopter crash http://t.co/0QP... http://t.co/iSNVo7wzFc,Related and informative
Crash victims service under way: A special service to remember the victims of the Glasgow helicopter crash is ... http://t.co/BjovSKR1mz,Related - but not informative
Glasgow helicopter crash: memorial service for victims http://t.co/WZFjBE2uEA 【英語学習書】　http://t.co/Qi25rszXJV,Related and informative
The helicopter crash in Glasgow is so sad :(,Related - but not informative
At least 1 person confirmed dead in Glasgow police helicopter crash chief said. http://t.co/VQHV0lEK1L,Related and informative
Scottish copter crash: Grim search for victims: Rescuers start removing the mangled wreck of a helicopter that... http://t.co/9F4n6B8fTU,Related and informative
Death toll rises in copter crash: Officials say at least 8 people have been killed after a police helicopter c... http://t.co/gnUiMPqZnm,Related and informative
8 people killed in the Glasgow helicopter crash and all I hear is Paul Walker Paul Walker Paul Walker...,Related - but not informative
GLASGOW POLICE HELICOPTER CRASH VICTIMS NAMED: http://t.co/LVeTfr3Eco,Related and informative
Everything I listen to this weekend seems poignant &amp; relevant. My thoughts are with all those affected by the tragedy #clutha,Related - but not informative
Terrible display by hearts fan who shouts done us a favour during minutes silence at tynecastle for helicopter crash #poortaste #coybig,Not related
so a helicopter crash  train derailment and paul walker dead!! 2013 finishing of were it began ...shite!!,Related - but not informative
Police press conference expected at 3.15pm #Clutha,Related and informative
@hammer_lee72 I care more about that helicopter crashing into that pub in Glasgow nobody cares because they weren't famous liberty,Related - but not informative
First parts of helicopter recovered from Glasgow crash site hoisted away to be inspected: http://t.co/zpzfr15eZ1,Related and informative
everyone I've spoken to today is sad bc of the Helicopter Crash my heart and prayers go out to all the families whom have lost loved ones🙏,Related - but not informative
Frank McKeown helps Glasgow helicopter rescue then plays for Stranraer http://t.co/RmJWaw2zIz,Related and informative
Sickens me that Paul walkers death is getting more attention then the Glasgow helicopter crash. Or even the other person who was in the car.,Related - but not informative
More of those who died when a police helicopter crashed into a busy Glasgow pub on Friday have been named. http://t.co/44ndeDmOuB,Related and informative
So disgusting that church blaming the helicopter crash on the gay marriage bill because god wouldn't accept it..Yet there all inter breeding,Related - but not informative
3 Die in Canadian Coast Guard Helicopter Crash - http://t.co/yOyaZnzFXb http://t.co/agtEVyJrFM,Not related
Glasgow pub helicopter crash victims mourned amid warning death toll could rise http://t.co/2dtB5fMFnK,Related and informative
Mark O'Prey's family: we keep calling Marks phone it just keeps ringing #Clutha,Related - but not informative
A train crash? A police helicopter crashing? It's all going on isn't it,Not related
So there's been a helicopter a car an a train crash all in 3 days wtf😔,Related - but not informative
#helicopter #day #control #fun http://t.co/YWCSZfJuLy,Not related
Car crash  helicopter crash  and train crash  thoughts are with the family's of those who passed so suddenly and unexpected!,Related - but not informative
.@onedirslaytion Glasgow helicopter crash: The victims: Tributes are paid to four of the eight people to have died whe...  @orgasmicgomez,Related - but not informative
@onedirslaytion Glasgow Helicopter Pub Crash: Nine Dead: Police say they have found a further body located within the ...  @orgasmicgomez,Related and informative
@onedirslaytion Helicopter Crash: Fears For 'Gentle Giant': The family of Mark O'Prey have told Sky News of their frus...  @orgasmicgomez,Related and informative
.@onedirslaytion Glasgow Helicopter Pub Crash: Nine Dead: Police say they have found a further body located within the...  @orgasmicgomez,Related and informative
Scottish Authorities Seek Clues to Copter Crash: Workers are cautiously removing the wreckage of a helicopter ... http://t.co/VkrjmFuepE,Related and informative
Scottish Authorities Seek Clues to Copter Crash: Workers are cautiously removing the wreckage of a helicopter ... http://t.co/g6fzZh58ya,Related and informative
RIP #9 #Clutha #cluthabar #cluthavaults so very sad,Related - but not informative
Death toll rises to 9 in Glasgow pub helicopter crash and more bodies could be found in rubble.,Related and informative
Helicopter Crash: Fears For 'Gentle Giant': The worried family of Mark O'Prey tell Sky News of their frustrati... http://t.co/2MQNjIBqN6,Related and informative
Police helicopter crashes into busy Scottish pub trapping revelers -  GLASGOW (Reuters) - A police helicopter... http://t.co/wqNENt94xT,Related and informative
Hope there are no more deaths in the helicopter crash.,Related - but not informative
Death tolls rises to nine in Scotland helicopter crash: LONDON (Reuters) - The number of people killed after a... http://t.co/lmzIoLkHgm,Related and informative
Glasgow helicopter crash death toll rises to nine http://t.co/A4R8eEzUxh,Related and informative
Delicate rescue operation after Glasgow helicopter crash: @YouTube aracılığıyla http://t.co/A1LVzQAQyD,Related and informative
I'm no expert but how long does it take to lift a small helicopter out of a building? #clutha,Related - but not informative
Death toll rises to nine in Glasgow helicopter crash and police fear more pub goers could be found in the rubble http://t.co/qalvmxTyr4,Related and informative
Helicopter crash Glasgow: First parts recovered from Clutha Bar http://t.co/OcVDewMY8J,Related and informative
Glasgow Helicopter Crash: Ninth Body Found http://t.co/kBGE0GMgEM,Related and informative
Glasgow helicopter crash: bravery of police officers who were killed  #news #uk http://t.co/VhzrmrG1X6,Related and informative
The first parts of the helicopter which tragically crashed into a Glasgow pub have been removed for inspection http://t.co/McZWA5gbqN,Related and informative
Glasgow helicopter crash: bravery of police officers who were killed: Two police officers commended for their heroism among at least ...,Related and informative
(BBC) Crash helicopter removed from pub http://t.co/sRceH1Lhvw,Related and informative
Crash helicopter removed from pub - BBC News Glasgow &amp; West http://t.co/uJdYh5lpJD,Related and informative
|» http://t.co/u1c2QxEhf9 858 Helicopter Crash Glasgow || In pictures: Glasgow pub helicopter crash || Microsoft || Liverpool || GBR || England|,Related and informative
So tragic!😟 May they RIP X “@the_overtones: Watching the news about the helicopter crash in Glasgow 9 people reported killed . Very sad Tx”,Related - but not informative
#Glasgow crash helicopter winched clear as relatives express frustration http://t.co/CpJBXx1cof,Related and informative
@onedirslaytion VIDEO: Crash helicopter removed from pub: Emergency services have removed a helicopter which crashed i...  @orgasmicgomez,Related and informative
Crash helicopter removed from pub: Rescuers remove a helicopter which crashed into a busy Glasgow pub on Frida... http://t.co/KxhXgxJw8r,Related and informative
This helicopter crash business is terrible.,Related - but not informative
A tribute to Glasgow by me #Clutha #helicoptercrash #Glasgow https://t.co/2AIgUXoiIw,Related - but not informative
Clutha helicopter crash: Carmichael praises police http://t.co/PNBl39TNmD,Related - but not informative
NEWS - EUROPE • Glasgow Helicopter Crash: Aircraft Removed From Pub: Rescuers have removed a helicopter which... http://t.co/xs4VBYHEFH,Related and informative
Flag at ERC HQ flying half mast in commemoration of the victims of the #Clutha tragedy. http://t.co/MATnTXP8U0,Related - but not informative
Glasgow helicopter crash: police raise death toll to nine http://t.co/Prcetr5oXu,Related and informative
@onedirslaytion No mayday call from crash helicopter: No mayday call was made from the police helicopter that crashed ...  @orgasmicgomez,Related and informative
On today's @MooneyShow Derek is hearing how #Glasgow2014 is coping with the tragic helicopter crash on Friday night,Related and informative
#Clutha pub Pope Francis has sent a message expressing his closeness to the people of Glasgow following the Clutha helicopter tragedy.,Related and informative
Photos of the day: Peruvian scissors dancers Glasgow helicopter crash China launches lunar rover- http://t.co/lGlkgVbJFC,Related - but not informative
Scientists hurt in Antartic crash: A helicopter carrying scientists on a mission in Antarctica crashed more th... http://t.co/B6r9IQqr7f,Not related
Scientists hurt in Antartic crash: A helicopter carrying scientists on a mission in Antarctica crashed more th... http://t.co/uLerNWzPz0,Not related
Scientists hurt in Antartic crash: A helicopter carrying scientists on a mission in Antarctica crashed more th... http://t.co/jZDij32OTk,Not related
Scientists hurt in Antartic crash: A helicopter carrying scientists on a mission in Antarctica crashed more th... http://t.co/2tX74KAMyW,Not related
Katie Hopkins apologises after Twitter fury over Glasgow helicopter crash joke http://t.co/06PkZiPA4b via @guardian,Related and informative
Pope Francis expresses closeness to Glasgow after helicopter tragedy http://t.co/Vc2QhxiR1w,Related and informative
Nasty Katie Hopkins apologises after making cruel disgusting remarks over Glasgow helicopter crash #CompleteTwat!  http://t.co/t1WGDIciR6,Related - but not informative
Why do arseholes continue making jokes about the helicopter crash..its not funny people lost their lives n their families lost loved ones !!,Related - but not informative
Motormouth Katie Hopkins says sorry over 'offensive' tweet after Scottish helicopter crash. she blames 'poor timing'. http://t.co/PgM1o9e0cY,Related - but not informative
|» http://t.co/YBo7wA71Af 34 Helicopter crash Glasgow || Glasgow Helicopter Crash: Police Name A Victim || Microsoft || Leeds || GBR || England|,Related and informative
Scotland mourns pub helicopter crash victims  http://t.co/5zA3RRYcXf,Related and informative
Er so the BBC have already created a documentary about the helicopter crash. WTF?,Related - but not informative
Anguished relatives say the response to the Glasgow helicopter crash is taking too long  http://t.co/gBBVKnGQXt,Related and informative
|» http://t.co/flt8q4ZJSG 176 Helicopter crash Glasgow || In pictures: Glasgow pub helicopter crash || Microsoft || Watford || GBR || England|,Related and informative
|» http://t.co/Eftte28Nqz 426 Helicopter crash Glasgow || Glasgow Helicopter Crash: Police Name A Victim || Microsoft || Sunderland || GBR || Eng…|,Related and informative
#crime Mangled frame of crashed police helicopter winched from Glasgow pub http://t.co/BArBf6a2qv http://t.co/vjUNGG1iYz,Related and informative
Watched @ScotlandTonight with a lump in my throat. A dignified but heart wrenching look back on the #Clutha tragedy. Still so surreal,Related - but not informative
Come on @BBCOne give the families time to grieve before airing your story of the helicopter crash! #norespect,Related and informative
Help us get 'People Make Glasgow' pins worn by G Matheson on @ScotlandTonight available2buy2fundraise for #Clutha victims. @colinmccredie,Related - but not informative
More helicopter crash victims named: The names of four more people who died in Friday night's Glasgow helicopter crash are released b...,Related and informative
@onedirslaytion More helicopter crash victims named: The names of four more people who died in Friday night's Glasgow ...  @orgasmicgomez,Related and informative
.@onedirslaytion More helicopter crash victims named: The names of four more people who died in Friday night's Glasgow...  @orgasmicgomez,Related and informative
@biebersxcunty More helicopter crash victims named: The names of four more people who died in Friday night's Glasgow ...  @onedirslaytion,Related and informative
@biebersxcunty Glasgow Helicopter Crash: Nine Victims Named  @onedirslaytion,Related and informative
@orgasmicgomez More helicopter crash victims named: The names of four more people who died in Friday night's Glasgow ...  @onedirslaytion,Related and informative
